{
  "device": {
    "id": "dev_factory_alpha",
    "organizationId": "org_alpha",
    "ownershipState": "claimed",
    "name": "Shcare Clinic Unit 01",
    "type": "stethoscope",
    "status": "connected",
    "connected": true,
    "online": true,
    "firmwareVersion": "0.9.0",
    "otaStatus": "delivered",
    "updatedAt": "2026-08-15T04:20:01.000Z",
    "ota": {
      "id": "cmd_ota_alpha_001",
      "commandId": "cmd_ota_alpha_001",
      "correlationId": "corr_ota_alpha_001",
      "firmwareVersion": "1.0.0",
      "checksum": "ca79de814dac8d6bb3a48eb87f80e6addf331c62009129c013c250f30a074801",
      "firmwareFileId": "firmware_msm261s4030h0_1_0_0",
      "firmwareFileName": "shcare-msm261s4030h0-1.0.0.bin",
      "hardwareTarget": "MSM261S4030H0",
      "partitionTarget": "app",
      "minimumProtocolVersion": 1,
      "expiresAt": "2026-08-16T04:20:00.000Z",
      "status": "delivered",
      "createdAt": "2026-08-15T04:20:00.000Z",
      "updatedAt": "2026-08-15T04:20:01.000Z"
    }
  },
  "ota": {
    "id": "cmd_ota_alpha_001",
    "commandId": "cmd_ota_alpha_001",
    "correlationId": "corr_ota_alpha_001",
    "firmwareVersion": "1.0.0",
    "checksum": "ca79de814dac8d6bb3a48eb87f80e6addf331c62009129c013c250f30a074801",
    "firmwareFileId": "firmware_msm261s4030h0_1_0_0",
    "firmwareFileName": "shcare-msm261s4030h0-1.0.0.bin",
    "hardwareTarget": "MSM261S4030H0",
    "partitionTarget": "app",
    "minimumProtocolVersion": 1,
    "expiresAt": "2026-08-16T04:20:00.000Z",
    "status": "delivered",
    "createdAt": "2026-08-15T04:20:00.000Z",
    "updatedAt": "2026-08-15T04:20:01.000Z"
  },
  "command": {
    "protocolVersion": 1,
    "id": "cmd_ota_alpha_001",
    "deviceId": "dev_factory_alpha",
    "organizationId": "org_alpha",
    "type": "ota.update",
    "correlationId": "corr_ota_alpha_001",
    "state": "delivered",
    "status": "delivered",
    "code": "TRANSPORT_DELIVERED",
    "detail": "Command delivered to an authenticated transport",
    "requestedByUserId": "usr_platform_admin",
    "issuedAt": "2026-08-15T04:20:00.000Z",
    "expiresAt": "2026-08-15T04:25:00.000Z",
    "executionExpiresAt": "2026-08-15T06:20:00.000Z",
    "acceptedAt": "2026-08-15T04:20:00.000Z",
    "queuedAt": "",
    "deliveredAt": "2026-08-15T04:20:01.000Z",
    "acknowledgedAt": "",
    "applyingAt": "",
    "appliedAt": "",
    "failedAt": "",
    "expiredAt": "",
    "delivery": {
      "websocket": true,
      "mqtt": false,
      "delivered": true
    },
    "createdAt": "2026-08-15T04:20:00.000Z",
    "updatedAt": "2026-08-15T04:20:01.000Z"
  },
  "delivery": {
    "websocket": true,
    "mqtt": false,
    "delivered": true
  },
  "responseStatus": 202
}
